{
  "id": "pypi.publish",
  "provider": "PyPI",
  "use": "Publishing and version checks for Python packages",
  "operations": [
    {
      "name": "setup",
      "class": "M",
      "route": "none"
    },
    {
      "name": "publish",
      "class": "E",
      "route": "reported"
    }
  ],
  "setup": [
    "Claim the project name",
    "Set up trusted publishing"
  ],
  "detect": {
    "hosts": [
      "pypi.org",
      "files.pythonhosted.org"
    ],
    "commands": [
      "twine"
    ]
  }
}
